{"schema_version":1,"verdict":"PASS","scope":{"base":"HEAD","changed_files":["src/index.ts"],"acceptance_criteria":"ServiceFlow acceptance SHA256 0568ce48ebad5f2aec6139f2f3345acf63065eb403a10d81d69a08b36ae91abf"},"risk":"critical","checks":[{"command":["formatter-probe"],"status":"pass","exit_code":0,"evidence":"Formatting only; no app audit."}],"findings":[],"untested":["Application quality not tested"],"residual_risk":"Formatter probe only","worktree_unchanged":true}